{
  "arch": "x86_64",
  "captured_at": "2026-07-14T18:19:16+02:00",
  "checks": {
    "head_recorded": true,
    "runtime_not_applicable_recorded": true
  },
  "git_head": "7e23b43458744d0c8cffcadbd874bf97fc03f0f5",
  "in_container": false,
  "kernel": "7.1.3-200.fc44.x86_64",
  "limits": [],
  "os": "Linux",
  "os_version": "#1 SMP PREEMPT_DYNAMIC Sat Jul  4 19:20:12 UTC 2026",
  "python": "3.14.6",
  "repo": {
    "branch": "agent/reconcile-workspace-lifecycle-state",
    "head": "7e23b43458744d0c8cffcadbd874bf97fc03f0f5",
    "path": ".",
    "status_porcelain": "",
    "worktree_clean": true
  },
  "runtime": {
    "reason": "State-only reconciliation has no application runtime; exact GitHub and release identities are recorded from the completed implementation finish receipt.",
    "required": false
  },
  "schema": "statedd.runtime_identity.v2",
  "timestamp": "2026-07-14T16:19:16.093447Z"
}
