{
  "arch": "x86_64",
  "captured_at": "2026-07-12T10:39:11+02:00",
  "checks": {
    "head_recorded": true,
    "runtime_not_applicable_recorded": true
  },
  "git_head": "19c660e9b9602cad1c995e39a06e804747f47395",
  "in_container": false,
  "kernel": "7.1.3-200.fc44.x86_64",
  "limits": [],
  "os": "Linux",
  "os_version": "#1 SMP PREEMPT_DYNAMIC Sat Jul  4 19:20:12 UTC 2026",
  "python": "3.14.6",
  "repo": {
    "branch": "bl-golden-path-closure-001",
    "head": "19c660e9b9602cad1c995e39a06e804747f47395",
    "path": ".",
    "status_porcelain": "",
    "worktree_clean": true
  },
  "runtime": {
    "reason": "docs/scripts-only slice",
    "required": false
  },
  "schema": "statedd.runtime_identity.v2",
  "timestamp": "2026-07-12T08:39:11.943893Z"
}
