{
  "arch": "x86_64",
  "captured_at": "2026-07-11T18:03:46+02:00",
  "checks": {
    "head_recorded": true,
    "runtime_not_applicable_recorded": true
  },
  "git_head": "0fec221f60caf91d43c9ef316492739c7f0dc4a4",
  "in_container": false,
  "kernel": "7.1.3-200.fc44.x86_64",
  "limits": [],
  "os": "Linux",
  "os_version": "#1 SMP PREEMPT_DYNAMIC Sat Jul  4 19:20:12 UTC 2026",
  "python": "3.14.6",
  "repo": {
    "branch": "bl-statedd-integration-001",
    "head": "0fec221f60caf91d43c9ef316492739c7f0dc4a4",
    "path": ".",
    "status_porcelain": "?? docs/evidence/2026-07-11-statedd-integration/",
    "worktree_clean": false
  },
  "runtime": {
    "reason": "docs/scripts-only slice",
    "required": false
  },
  "schema": "statedd.runtime_identity.v2",
  "timestamp": "2026-07-11T16:03:46.288228Z"
}
