{
  "arch": "x86_64",
  "captured_at": "2026-07-11T20:50:41+02:00",
  "checks": {
    "head_recorded": true,
    "runtime_not_applicable_recorded": true
  },
  "git_head": "98c53265c36649d3c58b0e61a8e8d7ecba8beb48",
  "in_container": false,
  "kernel": "7.1.3-200.fc44.x86_64",
  "limits": [],
  "os": "Linux",
  "os_version": "#1 SMP PREEMPT_DYNAMIC Sat Jul  4 19:20:12 UTC 2026",
  "python": "3.14.6",
  "repo": {
    "branch": "bl-okf-001",
    "head": "98c53265c36649d3c58b0e61a8e8d7ecba8beb48",
    "path": ".",
    "status_porcelain": "",
    "worktree_clean": true
  },
  "runtime": {
    "reason": "docs/scripts-only slice",
    "required": false
  },
  "schema": "statedd.runtime_identity.v2",
  "timestamp": "2026-07-11T18:50:41.224226Z"
}
