{
  "arch": "x86_64",
  "captured_at": "2026-07-12T11:04:50+02:00",
  "checks": {
    "head_recorded": true,
    "runtime_not_applicable_recorded": true
  },
  "git_head": "72c7c5f7cb8a590b76ae7796b377416707a09a79",
  "in_container": false,
  "kernel": "7.1.3-200.fc44.x86_64",
  "limits": [],
  "os": "Linux",
  "os_version": "#1 SMP PREEMPT_DYNAMIC Sat Jul  4 19:20:12 UTC 2026",
  "python": "3.14.6",
  "repo": {
    "branch": "fix-finish-branch-delete",
    "head": "72c7c5f7cb8a590b76ae7796b377416707a09a79",
    "path": ".",
    "status_porcelain": "",
    "worktree_clean": true
  },
  "runtime": {
    "reason": "Template root has no deployable runtime; provider contract tests and remote CI establish repository closure behavior.",
    "required": false
  },
  "schema": "statedd.runtime_identity.v2",
  "timestamp": "2026-07-12T09:04:50.088587Z"
}
